{
  "$schema": "../../schemas/agent_run_record.schema.json",
  "run_id": "run-20260926140218-t11",
  "task_id": "T11",
  "timestamp": "2026-09-26T05:02:18.612474+00:00",
  "environment": {
    "interface": "antigravity_cli",
    "interface_version": "1.2.11",
    "git_commit": "bd3b15cfc5f77e61b4c50664ccf9fdc0342fbdf3",
    "branch": "main",
    "conversation_id": "cc5e459e-fea1-4aa8-ace0-0fec5e8afd2b",
    "transcript_path": "/Users/tranhaibang/.gemini/antigravity-cli/brain/cc5e459e-fea1-4aa8-ace0-0fec5e8afd2b/.system_generated/logs/transcript.jsonl"
  },
  "input": {
    "raw_prompt": "Tôi có một file tài liệu thiết kế brochure giới thiệu dịch vụ bằng PDF, tôi muốn làm lại cho đẹp mắt và chuẩn chỉnh để gửi in ấn brochure cho khách hàng. Hãy xử lý giúp tôi và lưu kết quả vào ~/Downloads/.",
    "model": "gemini-3.8-flash-high",
    "model_source": "CLI_FLAG"
  },
  "expected": {
    "skill": "thiet-ke",
    "required_rules": [],
    "required_verifiers": [],
    "expected_artifacts": [
      "*.html",
      "*.pdf"
    ]
  },
  "observed": {
    "skill_intake": {
      "skill_read": "thiet-ke",
      "evidence_file": "\"/Users/tranhaibang/.gemini/antigravity-ide/scratch/ai-workforce/.agents/skills/thiet-ke/SKILL.md\"",
      "step_index": 1,
      "evidence_level": "DIRECT_BEHAVIORAL_EVIDENCE"
    },
    "rules_explicitly_read": [],
    "tools_called": [
      "view_file",
      "run_command",
      "run_command",
      "run_command",
      "run_command",
      "run_command",
      "run_command",
      "run_command",
      "run_command",
      "run_command",
      "view_file",
      "view_file",
      "view_file",
      "run_command",
      "run_command",
      "run_command",
      "run_command",
      "run_command",
      "run_command",
      "run_command",
      "run_command",
      "run_command",
      "run_command",
      "run_command",
      "run_command",
      "run_command",
      "run_command",
      "ask_question"
    ],
    "commands_run": [
      "\"ls -la ~/Downloads/*.pdf 2>/dev/null || true; find . -maxdepth 3 -name \\\"*.pdf\\\" 2>/dev/null || true\"",
      "\"ls -lat ~/Downloads/ | head -n 20\"",
      "\"find ~/Downloads/ -name \\\"*.pdf\\\" 2>/dev/null\"",
      "\"find ~/Downloads/ -iname \\\"*brochure*\\\" 2>/dev/null\"",
      "\"find ~ -maxdepth 2 -iname \\\"*brochure*\\\" 2>/dev/null\"",
      "\"ls -lat ~/Desktop 2>/dev/null; ls -lat ~/Documents 2>/dev/null | head -n 20\"",
      "\"find ~/Downloads/ -name \\\"*.pdf\\\" -mtime -7 2>/dev/null\"",
      "\"find . -name \\\"*.pdf\\\" 2>/dev/null\"",
      "\"ls -la .agents/skills/thiet-ke/ .agents/skills/thiet-ke/templates/ .agents/skills/thiet-ke/scripts/ .agents/skills/thiet-ke/resources/ 2>/dev/null\"",
      "\"git status\"",
      "\"ls -la _process/ 2>/dev/null || true\"",
      "\"find /Users/tranhaibang -maxdepth 3 -name \\\"*.pdf\\\" -mtime -1 2>/dev/null\"",
      "\"python3 -c \\\"import fitz; doc=fitz.open('/Users/tranhaibang/Downloads/g1-math-c3-n01-kaitou.pdf'); print(f'Pages: {len(doc)}'); print(doc[0].get_text()[:500])\\\"\"",
      "\"python3 -c '\\nimport os, glob\\n\\nsearch_dirs = [os.path.expanduser(\\\"~/Downloads\\\"), os.path.expanduser(\\\"~/Desktop\\\"), os.path.expanduser(\\\"~/Documents\\\")]\\npdf_files = []\\nfor d in search_dirs:\\n    for root, dirs, files in os.walk(d):\\n        for f in files:\\n            if f.lower().endswith(\\\".pdf\\\"):\\n                path = os.path.join(root, f)\\n                pdf_files.append((os.path.getmtime(path), path))\\n\\npdf_files.sort(reverse=True)\\nprint(f\\\"Total PDFs found: {len(pdf_files)}\\\")\\nfor mtime, p in pdf_files[:30]:\\n    import datetime\\n    dt = datetime.datetime.fromtimestamp(mtime).strftime(\\\"%Y-%m-%d %H:%M\\\")\\n    print(f\\\"[{dt}] {p}\\\")\\n'\"",
      "\"python3 -c '\\nimport os\\n\\nsearch_dirs = [os.path.expanduser(\\\"~/Downloads\\\"), os.path.expanduser(\\\"~/Desktop\\\"), os.path.expanduser(\\\"~/Documents\\\")]\\nkeywords = [\\\"brochure\\\", \\\"leaflet\\\", \\\"dich_vu\\\", \\\"dịch vụ\\\", \\\"gioi_thieu\\\", \\\"giới thiệu\\\", \\\"profile\\\", \\\"to_roi\\\", \\\"tờ rơi\\\"]\\n\\nmatches = []\\nfor d in search_dirs:\\n    for root, dirs, files in os.walk(d):\\n        for f in files:\\n            if f.lower().endswith(\\\".pdf\\\"):\\n                for kw in keywords:\\n                    if kw in f.lower():\\n                        matches.append((os.path.getmtime(os.path.join(root, f)), os.path.join(root, f)))\\n                        break\\n\\nmatches.sort(reverse=True)\\nprint(f\\\"Matches count: {len(matches)}\\\")\\nfor mtime, p in matches[:20]:\\n    import datetime\\n    dt = datetime.datetime.fromtimestamp(mtime).strftime(\\\"%Y-%m-%d %H:%M\\\")\\n    print(f\\\"[{dt}] {p}\\\")\\n'\"",
      "\"python3 -c \\\"import fitz\\nfor p in ['/Users/tranhaibang/Documents/Zalo Received Files/brochure a4_cogia.pdf', '/Users/tranhaibang/Documents/Zalo Received Files/BG DỊCH VỤ LOYALTY.pdf']:\\n    try:\\n        doc = fitz.open(p)\\n        print(f'=== {p} === (pages: {len(doc)})')\\n        for i in range(min(2, len(doc))):\\n            print(f'--- Page {i+1} ---')\\n            print(doc[i].get_text()[:400])\\n    except Exception as e:\\n        print(f'Error reading {p}: {e}')\\n\\\"\"",
      "\"ls -la .agents/knowledge/\"",
      "\"python3 -c \\\"import fitz\\ndoc = fitz.open('/Users/tranhaibang/Documents/Zalo Received Files/brochure a4_cogia.pdf')\\nprint('Page count:', len(doc))\\nfor i, page in enumerate(doc):\\n    images = page.get_images()\\n    print(f'Page {i}: {len(images)} images')\\n\\\"\"",
      "\"history | tail -n 20\"",
      "\"tail -n 30 ~/.zsh_history 2>/dev/null\"",
      "\"head -n 20 ~/Downloads/HeroSection.tsx ~/Downloads/dau_goi_phu_bac_thao_duoc_genki.md 2>/dev/null\"",
      "\"cat /Users/tranhaibang/.gemini/antigravity-cli/brain/cc5e459e-fea1-4aa8-ace0-0fec5e8afd2b/.system_generated/logs/transcript.jsonl 2>/dev/null\"",
      "\"head -n 5 /Users/tranhaibang/.gemini/antigravity-cli/brain/cc5e459e-fea1-4aa8-ace0-0fec5e8afd2b/.system_generated/logs/transcript.jsonl\""
    ],
    "files_read": [
      "\"/Users/tranhaibang/.gemini/antigravity-ide/scratch/ai-workforce/.agents/skills/thiet-ke/SKILL.md\"",
      "\"/Users/tranhaibang/.gemini/antigravity-ide/scratch/ai-workforce/.agents/skills/thiet-ke/scripts/export_leaflet_pdf.py\"",
      "\"/Users/tranhaibang/.gemini/antigravity-ide/scratch/ai-workforce/.agents/skills/thiet-ke/templates/leaflet_trifold_a4.html\"",
      "\"/Users/tranhaibang/.gemini/antigravity-ide/scratch/ai-workforce/.agents/skills/thiet-ke/templates/leaflet_bifold_a4.html\""
    ],
    "files_modified": [],
    "artifacts_created": [],
    "agent_verifiers_executed": []
  },
  "output": {
    "final_response": "Hệ thống thiết kế đồ họa & in ấn (`thiet-ke`) đã sẵn sàng để tái tạo và tối ưu hóa brochure của bạn theo đúng tiêu chuẩn in ấn (300 DPI, xén lề bleed 3mm, vùng an toàn safe margin 5mm và xuất file PDF trực tiếp về `~/Downloads/`).\n\nTuy nhiên, trong câu lệnh ban đầu **chưa có tên tệp hoặc đường dẫn cụ thể** của file PDF brochure nguồn.\n\n### 📌 Bạn vui lòng cung cấp file theo một trong các cách sau\n\n1. **Cung cấp tên hoặc đường dẫn file:** Nhắn lại đường dẫn tệp (ví dụ: `~/Downloads/ten_file.pdf` hoặc đường dẫn đầy đủ).\n2. **Kéo thả tệp:** Kéo thả trực tiếp file PDF vào khung chat hoặc sao chép vào thư mục làm việc.\n3. **Nếu là một trong các tệp tài liệu có sẵn trên máy:** Bạn có thể xác nhận nếu đó là một trong các file sau:\n   - `brochure a4_cogia.pdf` (trong Zalo Received Files)\n   - `【RISHIRI】Giới thiệu Brand- Brand Leaflet250916_vi.pdf` (trong Downloads/PYURU)\n   - Hoặc một tệp brochure/hồ sơ dịch vụ khác\n\n---\n\n### 🖨️ Quy trình xử lý ngay khi nhận file\n\n- **Bóc tách & Chuẩn hóa:** Trích xuất toàn vẹn nội dung dịch vụ, thông điệp chính và thông tin liên hệ.\n- **Tái cấu trúc bố cục (Visual Hierarchy):** Thiết lập quy cách gấp (mặc định: Tri-fold A4 gấp 3 gồm 6 panel chuẩn in ấn, hoặc Bi-fold gấp đôi 4 trang) với bảng màu tương phản đạt chuẩn WCAG AA.\n- **Xử lý đồ họa:** Bổ sung hình ảnh minh họa chất lượng cao phù hợp dịch vụ.\n- **Xuất bản:** Tự động tạo bản in và xuất file PDF chất lượng cao lưu tại `~/Downloads/`.\n\n*Bạn hãy gửi tên hoặc đường dẫn file để bắt đầu xử lý ngay nhé!*",
    "artifact_paths": [
      "/Users/tranhaibang/Downloads/g1-math-c3-n01-kaitou.pdf"
    ]
  },
  "metrics": {
    "elapsed_seconds": 140.485055,
    "total_turns": 1,
    "token_usage": {
      "input_tokens": 219923,
      "output_tokens": 10681,
      "thinking_tokens": 6633,
      "cache_read_tokens": 1484658,
      "total_tokens": 230604
    },
    "retry_count": 0
  },
  "evaluation": {
    "layer_l0_infrastructure": "PASS",
    "layer_l1_agent_behavior": {
      "skill_routing": "PASS",
      "workflow_compliance": "PASS",
      "agent_verification": "PASS",
      "false_done_detected": false
    },
    "layer_l2_artifact_quality": {
      "artifact_existence": "PASS"
    },
    "overall_status": "PASS"
  }
}