{
  "$schema": "../../schemas/agent_run_record.schema.json",
  "run_id": "run-20260926140629-t11",
  "task_id": "T11",
  "timestamp": "2026-09-26T05:06:29.513837+00:00",
  "environment": {
    "interface": "antigravity_cli",
    "interface_version": "1.2.11",
    "git_commit": "db3e03d6d46b528e169513793a2000ca6873b7f5",
    "branch": "main",
    "conversation_id": "00137472-4f9b-4616-a212-61bb3293a182",
    "transcript_path": "/Users/tranhaibang/.gemini/antigravity-cli/brain/00137472-4f9b-4616-a212-61bb3293a182/.system_generated/logs/transcript.jsonl"
  },
  "input": {
    "raw_prompt": "Tôi có một file tài liệu thiết kế brochure giới thiệu dịch vụ bằng PDF, tôi muốn làm lại cho đẹp mắt và chuẩn chỉnh để gửi in ấn brochure cho khách hàng. Hãy xử lý giúp tôi và lưu kết quả vào ~/Downloads/.",
    "model": "claude-sonnet-4-6",
    "model_source": "CLI_FLAG"
  },
  "expected": {
    "skill": "thiet-ke",
    "required_rules": [],
    "required_verifiers": [],
    "expected_artifacts": [
      "*.html",
      "*.pdf"
    ]
  },
  "observed": {
    "skill_intake": {
      "skill_read": null,
      "evidence_file": null,
      "step_index": null,
      "evidence_level": "NONE"
    },
    "rules_explicitly_read": [],
    "tools_called": [],
    "commands_run": [],
    "files_read": [],
    "files_modified": [],
    "artifacts_created": [],
    "agent_verifiers_executed": []
  },
  "output": {
    "final_response": "Tôi sẵn sàng giúp bạn làm lại brochure thật đẹp và chuẩn in ấn! 🎨\n\nTuy nhiên, tôi chưa thấy file PDF đính kèm trong tin nhắn của bạn. Bạn vui lòng:\n\n**Cung cấp thêm thông tin sau:**\n\n1. **📎 File PDF gốc** — Kéo thả file vào cửa sổ chat, hoặc cho tôi biết đường dẫn tuyệt đối đến file trên máy (ví dụ: `/Users/tranhaibang/Documents/brochure.pdf`)\n\n2. **🎯 Phong cách mong muốn** (tuỳ chọn):\n   - Chuyên nghiệp / Corporate\n   - Hiện đại / Minimalist\n   - Sang trọng / Premium\n   - Thân thiện / Friendly\n\n3. **📐 Kích thước brochure** (tuỳ chọn):\n   - A4 gấp đôi (A5 x2)\n   - A4 gấp ba (DL format)\n   - Khác?\n\nSau khi có file, tôi sẽ dùng skill **`thiet-ke`** để:\n- Phân tích nội dung và cấu trúc gốc\n- Tái thiết kế bố cục đẹp mắt, chuẩn bleed/margin in ấn\n- Xuất file PDF chuẩn 300 DPI CMYK sẵn sàng gửi nhà in\n- Lưu vào `~/Downloads/`",
    "artifact_paths": [
      "/Users/tranhaibang/Downloads/g1-math-c3-n01-kaitou.pdf"
    ]
  },
  "metrics": {
    "elapsed_seconds": 11.339585,
    "total_turns": 1,
    "token_usage": {
      "input_tokens": 54687,
      "output_tokens": 522,
      "thinking_tokens": 0,
      "cache_read_tokens": 0,
      "total_tokens": 55209
    },
    "retry_count": 0
  },
  "evaluation": {
    "layer_l0_infrastructure": "PASS",
    "layer_l1_agent_behavior": {
      "skill_routing": "UNKNOWN",
      "workflow_compliance": "PASS",
      "agent_verification": "PASS",
      "false_done_detected": false
    },
    "layer_l2_artifact_quality": {
      "artifact_existence": "PASS"
    },
    "overall_status": "UNKNOWN"
  }
}